{
  "canonicalization": {
    "encoding": "UTF-8_without_BOM_LF_terminated",
    "floats": "forbidden",
    "integer_range": "signed_64_bit",
    "manifest_self_hash_exclusion": "remove_only_top_level_manifest_sha256_before_reencoding",
    "profile": "indusbench-canonical-json-sort-keys-indent-2-v1",
    "receipt_self_hash_exclusion": "compute_before_adding_top_level_receipt_sha256"
  },
  "claim_chain_policy": {
    "candidate_limit": "declarations_and_internal_digest_chain_only_external_registry_not_verified_by_this_gate",
    "external_registration_requirement": "reserve_one_claim_slot_and_register_one_active_chain_head_binding_exact_draft_parent_plan_gate_bundle_typed_full_NMFA_execution_evaluator_bundle_manifest_prevalue_inventory_population_seals_signed_X_Y_audit_receipts_joint_E_G_review_identifier_rederivation_split_inventory_complete_split_eligible_roster_and_all_aborted_prior_slots",
    "fork_rule": "parallel_active_chains_retry_resalt_event_reuse_and_post_registration_supersession_forbidden",
    "nonce_anchor": "first_qualifying_event_strictly_after_external_registration_receipt_for_the_single_active_chain",
    "resource_availability_order": "parent_updated_at_strictly_before_plan_created_at_strictly_before_bundle_created_at_strictly_before_claim_slot_reservation_recorded_at_all_canonical_UTC_seconds_gate_does_not_verify_external_time"
  },
  "created_at": "2026-08-02T09:33:50Z",
  "decision": {
    "contract_error": "PREFLIGHT_CONTRACT_INVALID",
    "pass_state": "CANDIDATE_FOR_EXTERNAL_REGISTRATION_REVIEW",
    "terminal_precedence": [
      "SOURCE_VALUE_BLINDNESS_BREACH",
      "AUTHORITY_BLOCKED",
      "RIGHTS_BLOCKED",
      "CUSTODY_BLOCKED",
      "TARGET_CONTRACT_INCOMPLETE",
      "SOURCE_FRAME_INCOMPLETE",
      "POPULATION_MANIFEST_INVALID",
      "DEPENDENCE_CONTEXT_INVALID",
      "INSUFFICIENT_ELIGIBLE_G",
      "COMPUTATION_LIMIT_BLOCKED",
      "NO_FEASIBLE_DOMAIN_TUPLE",
      "N2_UNIVERSAL_SUPPORT_BLOCKED",
      "CANDIDATE_FOR_EXTERNAL_REGISTRATION_REVIEW"
    ]
  },
  "digest_dag": [
    {
      "inputs": [
        "exact_parent_protocol_raw_bytes"
      ],
      "node": "parent_protocol_sha256"
    },
    {
      "inputs": [
        "exact_gate_plan_raw_bytes"
      ],
      "node": "gate_plan_sha256"
    },
    {
      "inputs": [
        "exact_evaluator_bundle_raw_bytes"
      ],
      "node": "evaluator_bundle_sha256"
    },
    {
      "inputs": [
        "payload.context_contract:manifest.context_contract"
      ],
      "node": "context_contract_sha256"
    },
    {
      "inputs": [
        "payload.nuisance_vocabularies:manifest.context_contract.nuisance_vocabularies"
      ],
      "node": "nuisance_value_vocabularies_sha256"
    },
    {
      "inputs": [
        "payload.relation_policy:fixed_evaluator_relation_policy"
      ],
      "node": "relation_policy_sha256"
    },
    {
      "inputs": [
        "payload.rights:manifest.rights_when_every_evidence_sha256_is_nonnull"
      ],
      "node": "rights_evidence_set_sha256_or_null"
    },
    {
      "inputs": [
        "payload.ordered_opaque_source_roster:manifest.source_records",
        "payload.source_frame:manifest.source_frame"
      ],
      "node": "source_frame_sha256"
    },
    {
      "inputs": [
        "payload.sealed_dataset:manifest.sealed_datasets.transcription_x"
      ],
      "node": "transcription_seal_sha256"
    },
    {
      "inputs": [
        "payload.sealed_dataset:manifest.sealed_datasets.target_y"
      ],
      "node": "target_seal_sha256"
    },
    {
      "inputs": [
        "payload.claim_slot_id:manifest.claim_policy.claim_slot_id",
        "payload.data_layer:target_y_or_transcription_x",
        "payload.experiment_instance_id:manifest.experiment_instance_id",
        "payload.ordered_f_ids:manifest.units.f_id_in_manifest_order"
      ],
      "node": "sealed_f_roster_sha256_per_layer"
    },
    {
      "inputs": [
        "payload.claim_policy:manifest.claim_policy",
        "payload.context_rule_contract:fixed_context_mapping_policy_without_observed_ids",
        "payload.custody_contract_sha256:manifest.bindings.custody_contract_sha256",
        "payload.evaluator_bundle_sha256:manifest.bindings.evaluator_bundle_sha256",
        "payload.evidence_envelope_contract:manifest.evidence_envelope_contract",
        "payload.experiment_instance_id:manifest.experiment_instance_id",
        "payload.gate_plan_sha256:manifest.bindings.gate_plan_sha256",
        "payload.governance:manifest.governance",
        "payload.identifier_policy_without_key_commitment:manifest.identifier_contract_minus_key_commitment_sha256_field",
        "payload.nonce_event_contract:manifest.nonce_event_contract",
        "payload.parent_protocol_sha256:manifest.bindings.parent_protocol_sha256",
        "payload.prospective:manifest.prospective",
        "payload.protection:manifest.protection",
        "payload.rights:manifest.rights",
        "payload.sealed_dataset_contracts:manifest.sealed_datasets.contracts_only",
        "payload.source_frame_rule_contract:fixed_source_frame_rules_without_observed_roster",
        "payload.staged_release_contract:manifest.staged_release_contract",
        "payload.target_contract_without_opaque_unit_id:manifest.target_without_canonical_unit_id"
      ],
      "node": "claim_slot_reservation_sha256"
    },
    {
      "inputs": [
        "payload.claim_slot_reservation_receipt:manifest.freeze_sequence.claim_slot_reservation_receipt",
        "payload.claim_slot_reservation_sha256:recomputed_claim_slot_reservation_sha256",
        "payload.claim_slot_id:manifest.claim_policy.claim_slot_id",
        "payload.experiment_instance_id:manifest.experiment_instance_id",
        "payload.identifier_contract:manifest.identifier_contract"
      ],
      "node": "identifier_key_ceremony_sha256"
    },
    {
      "inputs": [
        "payload.claim_policy:manifest.claim_policy",
        "payload.claim_slot_reservation_receipt:manifest.freeze_sequence.claim_slot_reservation_receipt",
        "payload.claim_slot_reservation_sha256:manifest.bindings.claim_slot_reservation_sha256",
        "payload.context_contract:manifest.context_contract",
        "payload.custody_contract_sha256:manifest.bindings.custody_contract_sha256",
        "payload.evaluator_bundle_sha256:manifest.bindings.evaluator_bundle_sha256",
        "payload.evidence_envelope_contract:manifest.evidence_envelope_contract",
        "payload.experiment_instance_id:manifest.experiment_instance_id",
        "payload.exposure_control:manifest.exposure_control",
        "payload.gate_plan_sha256:manifest.bindings.gate_plan_sha256",
        "payload.governance:manifest.governance",
        "payload.identifier_contract:manifest.identifier_contract",
        "payload.identifier_key_ceremony_sha256:manifest.bindings.identifier_key_ceremony_sha256",
        "payload.identifier_key_generation_receipt:manifest.freeze_sequence.identifier_key_generation_receipt",
        "payload.n1_deferred_contract:manifest.n1_deferred_contract",
        "payload.nonce_event_contract:manifest.nonce_event_contract",
        "payload.parent_protocol_sha256:manifest.bindings.parent_protocol_sha256",
        "payload.prevalue_f_context_inventory:manifest.units_exact_F_C_context_evidence_physical_identity_evidence_and_source_membership_without_post_X_relation_evidence",
        "payload.prevalue_prior_project_exposure:manifest.eligibility_exact_F_and_prior_project_exposure_only",
        "payload.prospective:manifest.prospective",
        "payload.protection:manifest.protection",
        "payload.relation_policy:fixed_evaluator_relation_policy",
        "payload.rights:manifest.rights",
        "payload.sealed_dataset_contracts.target_y:manifest.sealed_datasets.target_y.contract",
        "payload.sealed_dataset_contracts.transcription_x:manifest.sealed_datasets.transcription_x.contract",
        "payload.clean_roles_first_claim_instance_source_metadata_access_receipt:manifest.freeze_sequence.clean_roles_first_claim_instance_source_metadata_access_receipt",
        "payload.source_frame:manifest.source_frame_exact_prevalue_state",
        "payload.source_records:manifest.source_records_exact_ordered_record_revision_view_entry_and_F_mapping",
        "payload.staged_release_contract:manifest.staged_release_contract",
        "payload.target:manifest.target"
      ],
      "node": "preinventory_contract_sha256"
    },
    {
      "inputs": [
        "payload.claim_policy:manifest.claim_policy",
        "payload.context_contract:manifest.context_contract",
        "payload.eligibility:manifest.eligibility",
        "payload.evidence_envelope_contract:manifest.evidence_envelope_contract",
        "payload.experiment_instance_id:manifest.experiment_instance_id",
        "payload.exposure:manifest.exposure",
        "payload.exposure_control:manifest.exposure_control",
        "payload.identifier_contract:manifest.identifier_contract",
        "payload.relations:manifest.relations",
        "payload.sealed_datasets:manifest.sealed_datasets",
        "payload.source_frame:manifest.source_frame",
        "payload.source_records:manifest.source_records",
        "payload.staged_release_contract:manifest.staged_release_contract",
        "payload.target:manifest.target",
        "payload.units:manifest.units"
      ],
      "node": "population_inventory_sha256"
    },
    {
      "inputs": [
        "payload.axis_order:site_period_medium_object_type",
        "payload.context_semantics:closure_nuisance_vocabularies_and_provenance_policy",
        "payload.eligibility:manifest.eligibility_without_attestation_ids",
        "payload.relations:manifest.relations_without_evidence_envelopes",
        "payload.units:manifest.units_F_and_C_only"
      ],
      "node": "split_structural_input_sha256"
    },
    {
      "inputs": [
        "payload.claim_slot_reservation_receipt:manifest.freeze_sequence.claim_slot_reservation_receipt",